{
  "$schema": "../color-evidence.schema.json",
  "schemaVersion": 1,
  "evidenceKind": "web-rendered",
  "platform": "web",
  "theme": "dark",
  "surfaceId": "example-dark-surface",
  "screenshotPath": "evidence/example-dark.png",
  "computedColorPath": "evidence/example-dark-computed.json",
  "nodes": [
    {
      "id": "approved-palette",
      "owner": "example-approved",
      "mediaRole": "surface",
      "context": "brand",
      "colorSource": "computed",
      "foreground": "#18202A",
      "background": "#F0F1F3",
      "fontSize": 0,
      "fontWeight": 400,
      "fillKind": "solid",
      "palettePattern": "purple-violet-gradient",
      "paletteApproved": true,
      "paletteId": "brand-accent",
      "surfaceTemperature": "neutral",
      "glowPresent": false,
      "glowColor": "#000000",
      "glowBlur": 0,
      "neutralElevation": false,
      "radialSaturated": false,
      "radialOpacity": 0,
      "radialDecorative": false,
      "monochromeAsset": false
    },
    {
      "id": "neutral-shadow",
      "owner": "example-shadow",
      "mediaRole": "surface",
      "context": "component",
      "colorSource": "computed",
      "foreground": "#18202A",
      "background": "#F0F1F3",
      "fontSize": 0,
      "fontWeight": 400,
      "fillKind": "solid",
      "palettePattern": "none",
      "paletteApproved": true,
      "surfaceTemperature": "neutral",
      "glowPresent": true,
      "glowColor": "#000000",
      "glowBlur": 24,
      "neutralElevation": true,
      "radialSaturated": false,
      "radialOpacity": 0,
      "radialDecorative": false,
      "monochromeAsset": false
    },
    {
      "id": "owned-extreme",
      "owner": "example-media",
      "mediaRole": "surface",
      "context": "brand",
      "colorSource": "computed",
      "foreground": "#18202A",
      "background": "#000000",
      "fontSize": 0,
      "fontWeight": 400,
      "fillKind": "solid",
      "palettePattern": "none",
      "paletteApproved": true,
      "surfaceTemperature": "neutral",
      "glowPresent": false,
      "glowColor": "#000000",
      "glowBlur": 0,
      "neutralElevation": false,
      "radialSaturated": false,
      "radialOpacity": 0,
      "radialDecorative": false,
      "monochromeAsset": false,
      "mediumExceptionOwner": "example-media"
    },
    {
      "id": "monochrome",
      "owner": "example-asset",
      "mediaRole": "monochrome-asset",
      "context": "brand",
      "colorSource": "computed",
      "foreground": "#18202A",
      "background": "#FFFFFF",
      "fontSize": 0,
      "fontWeight": 400,
      "fillKind": "solid",
      "palettePattern": "none",
      "paletteApproved": true,
      "surfaceTemperature": "neutral",
      "glowPresent": false,
      "glowColor": "#000000",
      "glowBlur": 0,
      "neutralElevation": false,
      "radialSaturated": false,
      "radialOpacity": 0,
      "radialDecorative": false,
      "monochromeAsset": true
    },
    {
      "id": "brand-low-contrast",
      "owner": "example-brand",
      "mediaRole": "text",
      "context": "brand",
      "colorSource": "computed",
      "foreground": "#777777",
      "background": "#666666",
      "fontSize": 16,
      "fontWeight": 400,
      "fillKind": "solid",
      "palettePattern": "none",
      "paletteApproved": true,
      "surfaceTemperature": "neutral",
      "glowPresent": false,
      "glowColor": "#000000",
      "glowBlur": 0,
      "neutralElevation": false,
      "radialSaturated": false,
      "radialOpacity": 0,
      "radialDecorative": false,
      "monochromeAsset": false,
      "mediumExceptionOwner": "example-brand"
    }
  ]
}
